{
  "$schema": "https://stratifypro.io/schema/rule-pack-1.json",
  "id": "fda-524b",
  "version": "1.0.0",
  "title": "FDA section 524B premarket submission profile",
  "compiled": "2026-09-13",
  "sourceDocuments": [
    {
      "id": "fdc-524b",
      "title": "Federal Food, Drug, and Cosmetic Act section 524B, Ensuring Cybersecurity of Devices",
      "citation": "21 U.S.C. 360n-2(b)(3)",
      "publisher": "United States Congress",
      "published": "2022-12-29",
      "effective": "2023-03-29",
      "url": "https://www.law.cornell.edu/uscode/text/21/360n-2",
      "normativeLanguage": true,
      "normativeLanguageEvidence": "Statutory 'shall': a sponsor of a cyber device shall 'provide to the Secretary a software bill of materials, including commercial, open-source, and off-the-shelf software components.' Added by section 3305 of the Consolidated Appropriations Act, 2023.",
      "note": "This is the only source in either pack that carries genuine normative language, and it is the only source that may support severity 'error'."
    },
    {
      "id": "fda-premarket-2026-02",
      "title": "Cybersecurity in Medical Devices: Quality Management System Considerations and Content of Premarket Submissions",
      "publisher": "US Food and Drug Administration, CDRH",
      "published": "2026-02-03",
      "supersedes": "The 27 June 2025 version, which superseded the 27 September 2023 version.",
      "url": "https://www.fda.gov/media/119933/download",
      "normativeLanguage": false,
      "normativeLanguageEvidence": "Guidance, not regulation. Uses 'should' and 'recommends' throughout. FDA guidance documents state on their face that they do not establish legally enforceable responsibilities.",
      "note": "The SBOM text in section V.A.4(b) is word-for-word identical across the September 2023, June 2025 and February 2026 versions. The 2026 change was a QMSR and ISO 13485 realignment elsewhere in the document. There is no pending FDA change to chase."
    },
    {
      "id": "ntia-2021",
      "title": "Framing Software Component Transparency: Establishing a Common Software Bill of Materials (SBOM)",
      "publisher": "NTIA Multistakeholder Process on Software Component Transparency",
      "published": "2021-10",
      "url": "https://www.ntia.gov/report/2021/minimum-elements-software-bill-materials-sbom",
      "normativeLanguage": false,
      "note": "IMPORTANT AND EASY TO GET WRONG: the February 2026 FDA guidance still points at the OCTOBER 2021 NTIA baseline attributes, not at the CISA 2026 v2.1 elements. Checking an FDA submission against the 2026 CISA element set is checking against a document FDA has not adopted. The two packs are therefore different on purpose and must not be merged."
    }
  ],
  "severityModel": {
    "default": "warning",
    "justification": "Severity here tracks the enforcement consequence, not the source document's tone. Section 524B(b)(3) is a statutory 'shall', so the total absence of a machine-readable SBOM is an error: it is a straightforward Refuse to Accept trigger and FDA's temporal carve-out expired on 1 October 2023. Everything the guidance frames as 'should', including the NTIA baseline attributes, support level and end-of-support date, is a warning: those come back as review deficiencies or eSTAR technical screening holds, which cost time rather than the filing. Firms may override any severity.",
    "overridable": true,
    "enforcementNote": "Two mechanisms, and they are different. Refuse to Accept applies to statutory absence. The live day-to-day mechanism for a deficient submission is an eSTAR technical screening hold: per FDA's own cybersecurity FAQ, 'An eSTAR submission will be put on a Technical Screening hold if it does not contain accurate responses and relevant attachments in the Cybersecurity section.' Never describe a deficiency as a rejection."
  },
  "conformanceNote": "FDA names no file format. The guidance requires machine-readability plus the NTIA baseline attributes, says 'Industry-accepted formats of SBOMs are encouraged', and never mentions SPDX, CycloneDX or SWID anywhere in its text. These rules therefore check for information, never for a named format's field. Depth: FDA asks for the full stack including upstream transitive dependencies, which is materially deeper than the EU floor.",
  "rules": [
    {
      "id": "FDA-STAT-001",
      "title": "A software bill of materials exists and is machine-readable",
      "severity": "error",
      "severityJustification": "Section 524B(b)(3) is a statutory shall. FDA's temporal carve-out for cyber devices expired on 1 October 2023, after which section 524B information is by itself a sufficient basis for a Refuse to Accept decision. The absence of a machine-readable SBOM is the clearest case there is.",
      "onEmptySelector": "fire",
      "onEmptySelectorJustification": "The selector is the document root, which is present in every parsed document, so this rule can never see an empty selector. The value is declared because the field is required of every rule, and fire is the conservative choice should a future selector change make it reachable.",
      "appliesTo": [
        "cyclonedx",
        "spdx"
      ],
      "selector": {
        "cyclonedx": "$",
        "spdx": "$"
      },
      "assert": {
        "allOf": [
          {
            "exists": "bomFormat|spdxVersion|@context"
          },
          {
            "exists": "components|packages"
          }
        ]
      },
      "fix": "Provide a machine-readable SBOM. FDA names no format; industry-accepted formats are encouraged.",
      "note": "STATUTORY. This is the only rule in either pack whose severity rests on normative language rather than on a documented consequence.",
      "sourceDocument": "fdc-524b",
      "sourceLocation": "Section 524B(b)(3), 21 USC 360n-2(b)(3)",
      "alsoSee": [
        {
          "sourceDocument": "fda-premarket-2026-02",
          "sourceLocation": "Section VII.C.3, SBOM"
        }
      ]
    },
    {
      "id": "FDA-STAT-002",
      "title": "The SBOM enumerates commercial, open-source and off-the-shelf components",
      "severity": "error",
      "severityJustification": "The statute names all three categories explicitly. An SBOM that lists only the manufacturer's own code is not the artifact the statute asks for, and its absence is a statutory gap rather than a quality problem.",
      "onEmptySelector": "fire",
      "onEmptySelectorJustification": "The selector is the document root, which is present in every parsed document, so this rule can never see an empty selector. The value is declared because the field is required of every rule, and fire is the conservative choice should a future selector change make it reachable.",
      "appliesTo": [
        "cyclonedx",
        "spdx"
      ],
      "selector": {
        "cyclonedx": "$",
        "spdx": "$"
      },
      "assert": {
        "minLength": {
          "field": "components|packages",
          "min": 1
        }
      },
      "fix": "Enumerate every component including purchased and licensed software, open source, and off-the-shelf software, not only first-party code.",
      "note": "STATUTORY. Counting is a weak proxy for the real requirement; a human still has to confirm the categories are actually represented.",
      "sourceDocument": "fdc-524b",
      "sourceLocation": "Section 524B(b)(3), 21 USC 360n-2(b)(3)",
      "alsoSee": [
        {
          "sourceDocument": "fda-premarket-2026-02",
          "sourceLocation": "Section VII.C.3, SBOM"
        }
      ]
    },
    {
      "id": "FDA-NTIA-001",
      "title": "Supplier name is present for every component",
      "severity": "warning",
      "severityJustification": "An NTIA baseline attribute. The guidance frames these as 'should', and in practice a missing baseline attribute returns as a review deficiency or an eSTAR technical screening hold rather than a refusal, so it costs weeks rather than the filing.",
      "onEmptySelector": "fire",
      "onEmptySelectorJustification": "The selector walks a collection and the assertion asks whether each member carries something. A document with zero members has not satisfied that requirement, it has avoided being measured against it, and reporting nothing would let an empty or absent collection read as a clean result. The absence is the violation.",
      "appliesTo": [
        "cyclonedx",
        "spdx"
      ],
      "selector": {
        "cyclonedx": "$.components[*]",
        "spdx": "$.packages[*]"
      },
      "assert": {
        "anyOf": [
          {
            "exists": "publisher"
          },
          {
            "exists": "supplier"
          },
          {
            "exists": "originator"
          }
        ]
      },
      "fix": "Name the supplier of each component. Measured across 10,000 repositories, zero percent of generated SBOMs carry this, so expect to add it by hand or fix your generator.",
      "note": "NTIA 2021 BASELINE, not CISA 2026. FDA has not adopted the 2026 element set.",
      "sourceDocument": "ntia-2021",
      "sourceLocation": "Minimum elements, baseline attributes table",
      "alsoSee": [
        {
          "sourceDocument": "fda-premarket-2026-02",
          "sourceLocation": "Section V.A.4(b), first paragraph"
        }
      ]
    },
    {
      "id": "FDA-NTIA-002",
      "title": "Component name is present",
      "severity": "warning",
      "severityJustification": "An NTIA baseline attribute. The guidance frames these as 'should', and in practice a missing baseline attribute returns as a review deficiency or an eSTAR technical screening hold rather than a refusal, so it costs weeks rather than the filing.",
      "onEmptySelector": "fire",